,urls,authors,dates,headlines,contents
38,https://www.manilatimes.net/2021/02/28/news/headlines/health-care-workers-can-choose-vaccine/846160/,"Catherine S. Valente, TMT","February 28, 2021",Health care workers can choose vaccine,"HEALTH workers will not lose their priority status even if they refuse to be inoculated with the vaccine for the coronavirus disease 2019 (Covid-19) that will be arriving from China this Sunday, Malacañang spokesman Harry Roque Jr. said. Palace spokesman Harry Roque Jr. TMT file photo Speaking in Filipino during an interview with state-run PTV 4 on Saturday, Roque said the “change in protocol” also meant that the health workers could wait for their preferred brand. Roque gave the assurance as 600,000 doses of CoronaVac, the first batch that the Philippines will be receiving from its manufacturer Sinovac Biotech Ltd., and 525,600 doses from British-Swedish drugmaker AstraZeneca through the Covax Facility will be arriving on Sunday and Monday, respectively. It also came a day after health personnel from the Philippine General Hospital protested against the government plan to inoculate them with the Chinese-made vaccine and demanded that they be given “the safest dose” with the “highest efficacy rate” although they did not name a specific brand. The Inter-Agency Task Force for the Management of Emerging Infectious Diseases (IATF-EID) had approved the recommendation of the National Immunization Technical Advisory Group and the Department of Health’s Technical Advisory Group to allow the administration of Sinovac vaccines to frontline medical workers. The IATF-EID’s approval comes despite results of clinical trials showing that the Sinovac vaccine only has a 50.4-percent efficacy rate among health care workers exposed to Covid-19. The Palace official clarified that the new rule would only apply to health care workers because of the condition stipulated in the Emergency Use Authorization (EUA) that the Food and Drug Administration (FDA) issued to Sinovac. “Pang-health care workers lang po iyan. Sa lahat po, kinakailangan po talaga kung ano ang naririyan ay tatanggapin natin (That’s just for health care workers. So, the rest must accept whatever vaccine is available),” Roque said. Nonetheless, Roque said no one would be forced to take CoronaVac. The FDA had allowed the emergency use of CoronaVac on healthy individuals aged 18 to 59 not including health care workers. On Wednesday, Roque said the government decided to administer the Sinovac vaccine to “economic frontliners” from 18 to 59 years old. He said Cabinet officials and even Vice President Maria Leonor “Leni” Robredo might also be among the first in line to receive the vaccines from Sinovac. Roque said the government was “excited” over the delivery of the vaccines with President Rodrigo Duterte himself personally attending the ceremony prepared at the Villamor Airbase in Pasay City on Sunday afternoon. AstraZeneca, too A day after the arrival of the Sinovac vaccines, the first round of the allocated doses from AstraZeneca from the Covax Facility will be arriving at noontime on Monday, Roque announced late Saturday in a statement. “This forms part of the 44 million doses of Covax to inoculate 20 percent of our population,” he said. Roque thanked the co-leaders of the Covax Facility — World Health Organization, the Global Alliance for Vaccines and Immunization, the Coalition for Epidemic Preparedness Innovations and the United Nations Children’s Fund — toward this end. The Philippines stands to get 9.4 million doses from AstraZeneca and US drugmaker Pfizer-BioNTech through the Covax Facility, vaccine czar Carlito Galvez Jr. had said. The FDA has previously granted EUAs to both Pfizer and AstraZeneca vaccines. MMDA ready In anticipation of the arrival of the Sinovac vaccines, the Metropolitan Manila Development Authority (MMDA) announced on Saturday that it was ready to deliver the first batch of vaccines to their destinations. MMDA Chairman Benjamin Abalos Jr. said the vaccines would initially be stored at the Health department’s cold storage warehouse in Marikina City. Abalos said during the Laging Handa public briefing on PTV-4 that the MMDA’s Bus Carousel along EDSA or its adjoining lane would be used to hasten the delivery of the vaccines to at least 30 hospitals. Abalos said based on their simulations, they might be able to make the deliveries from the warehouse to the different hospitals in Metro Manila where the vaccines would be administered earlier than expected and advised motorists passing through the same route to give way to the six 40-foot container vans."
39,https://www.manilatimes.net/2021/02/28/opinion/editorial/confident-of-rebound-despite-challenges/846098/,The Manila Times,"February 28, 2021",Confident of rebound despite challenges," Economic managers, along with others monitoring the country’s pulse, remain confident of a healthy rebound this year. This is welcome news, given that gross domestic product (GDP) contracted 9 percent in 2020, mainly because of the response against the coronavirus pandemic that has killed some 2.5 million people worldwide. FIRST FOR THE YEAR (Clockwise from top left) Bangko Sentral ng Pilipinas Gov. Benjamin Diokno, BDO Capital & Investment Corporation President Eduardo Francisco, Finance Secretary Carlos Dominguez 3rd and former finance secretary and Asia Pacific Credit Suisse Managing Director Jose Isidro Camacho speak during The Manila Times’ economic forum, Rising from the ashes: From Pan-Asian to pan-global, on Feb. 26, 2021. SCREENGRABBED FROM THE EVENT At The Manila Times economic forum on Friday, Finance Secretary Carlos Dominguez 3rd sees a GDP growth of between 6.5 percent and 7.5 percent this year, the same forecast that was announced earlier. Central bank Governor Benjamin Diokno said inflation would be “benign” despite moves to ramp up consumer spending and the cost-push price increases seen recently. Former Finance secretary Jose Isidro Camacho, now the Credit Suisse Asia-Pacific managing director and vice president in Singapore, pointed out that the Philippines stood to benefit from its inclusion in Asean or Association of Southeast Asian Nations. That regional bloc, he added, was expected to grow 6 percent this year. And finally, Eduardo Francisco, BDO Capital and Investment Corp. president, said Philippine firms were generally healthy enough to weather the pandemic’s effects. Assumptions and caveats For the most part, we agree with the rosy outlook. But as in any forecast, certain assumptions were made. There were also a few caveats mentioned by the forum’s speakers, particularly related to the Covid-19 vaccines and the quality of recovery expected, that policymakers and other national leaders should not ignore. First, Secretary Dominguez mentioned that Congress needed to pass as many as 14 pieces of legislation certified as “priority” because of their role in economic recovery. Among the priority bills is Guide — Government Financial Institutions Unified Initiatives to Distressed Enterprises for Economic Recovery. Urgent amendments were also needed in the Foreign Investment Act, Public Service Act and Retail Trade Liberalization Act. These, the secretary added, would complement the country’s participation in the RCEP, the Regional Comprehensive Economic Partnership, the largest multilateral trade agreement in the world. Whether Congress will buckle down to work on these proposals amid the distractions from the upcoming elections is yet to be seen. We should be vigilant against and intolerant of delays. Speaking of RCEP, Mr. Camacho was bullish about that multilateral agreement but explained that the dividends from it would not be seen soon. Meanwhile, the government has to do better in acquiring Covid-19 vaccines. We agree. As we pointed out many times in this space, the Philippine economy is consumption-led. Personal spending accounts for about 70 percent of GDP. And so, an economic recovery effort has to be anchored on easing the quarantine measures and bolstering consumer confidence by ensuring public health safety. The way to do that is to inoculate enough Filipinos to establish herd immunity. Regrettably, vaccines are proving to be difficult to acquire, a situation resulting from the perilous combination of global supply issues and poor administration of this health crisis. Worse, the slow vaccine rollout, which hopefully starts today, exacerbated the wealth gap, as well as the divide between the politically connected and others without similar connections. That matters and not only because viruses do not discriminate according to income brackets and political camps. Of course, there is labor. Most workers will not qualify to be among those on the priority list of people to be inoculated. If workers remain unprotected from the virus, restarting industries will be a struggle. There are also small enterprises, which are more vulnerable to the economic fallout. Micro, small and medium enterprises (MSMEs) account for more than 96 percent of all registered firms in the country. MSMEs also employ 62.4 percent of the labor force, and they contribute 35.7 percent of the value added and 25 percent of export revenues.
To be fair, the Duterte government’s mantra is to “heal as one.” That sounds reassuring, but not everyone appears to be on the same page, so to speak. Instead, many seem more Darwinian — that is, survival of the fittest in terms of wealth and privilege. National leaders need to address these inequities, if the rosy economic forecasts mentioned earlier are to be realized."
40,https://www.manilatimes.net/2021/02/28/news/regions/covid-19-victims-get-cash-assistance/846022/,Frederick Silverio,"February 28, 2021",Covid-19 victims get cash assistance,"THE Bulacan provincial government has provided more than P13-million financial assistance to the families of Bulakenyos who died of Covid-19 in accordance with a provincial ordinance. On Friday, Gov. Daniel Fernando personally handed over checks worth P30,000 each to the family of the deceased under Provincial Ordinance 86-2020. According to Provincial Social Welfare and Development chief Rowena Joson-Tiongson, the financial assistance is contained in the said ordinance, enacted in May 2020 at the height of the pandemic. “Mahirap at masakit ang mawalan ng mahal sa buhay. Hindi po natin alam at walang makapagsasabi kung ano ang mangyayari sa atin sa susunod na mga araw kaya huwag makalimot na magpasalamat at manalangin sa Diyos. Kami po ay palagi naririto at handang dumamay (It is difficult and painful to lose a loved one. We can never tell what will happen to us in the following days, which is why we should remember to give thanks and pray to the Lord. We public servants are always here and ready to sympathize),” said Fernando. The governor continues to call on his fellow Bulakenyos to observe health and safety protocols. Currently, Bulacan has a total of 12,608 Covid-19 cases, 701 of which are active cases and 446 are recorded as dead."
41,https://www.manilatimes.net/2021/02/27/news/palace-astrazeneca-vaccines-to-arrive-in-ph-on-march-1/846175/,"Catherine S. Valente, TMT","February 27, 2021",Palace: Astrazeneca vaccines to arrive in PH on March 1,"THE first batch of British-Swedish drugmaker AstraZeneca’s coronavirus shots from the Covax facility will arrive in the Philippines on Monday, Malacañang said.. Palace spokesman Harry Roque Jr. said the 525,600 vaccine doses from the Covax facility would arrive “around noontime, as part of the first round of allocated doses from the Covax facility”. Roque said the initial delivery forms “part of the 44 million doses of Covax to inoculate 20 percent” of the population. Roque thanked the World Health Organization, the Global Alliance for Vaccines and Immunization, the Coalition for Epidemic Preparedness Innovations and the United Nations Children’s Fund toward this end. “We are grateful to everyone — from our medical frontliners to our fellow Filipinos and foreign partners — who stand by us in this challenging time,” he said. “Together, we will heal and recover as one nation and one people,” the Palace official added. The Philippines stands to get 9.4 million doses from AstraZeneca and US drugmaker Pfizer-BioNTech through Covax facility, vaccine czar Carlito Galvez Jr. had said. About 5.5 million of the 9.2 million doses are expected from AstraZeneca, whose initial delivery was scheduled mid to late February. On the other hand, 117,000 doses will come from Pfizer-BioNTech. The country’s Food and Drug Administration (FDA) has previously granted emergency use authorizations (EUAs)to both Pfizer and AstraZeneca vaccines. The Philippine government is also set to receive the first batch of the Sinovac vaccines from China at 5 p.m. at the Villamor Air Base in Pasay City today, February 28. The Philippines, which has logged more than 570,000 Covid-19 cases, aims to inoculate up to 70 million individuals to achieve herd immunity against the coronavirus."
42,https://www.manilatimes.net/2021/02/27/news/ph-logs-highest-number-of-covid-cases-in-4-months/846176/,Red Mendoza,"February 27, 2021",PH logs highest number of Covid cases in 4 months,"THE Department of Health (DoH) said the Philippines logged 2,921 cases of the coronavirus disease 2019 (Covid-19) on Saturday, the highest since Sept. 28, 2020, when the country recorded 3,063 infections. Since Jan. 31, 2020, there is now a total of 574,247 infections in the country, the second highest in Southeast Asia. Of the 37,093 cases that are active (6.5 percent of the total), almost 96 percent are mild, moderate and asymptomatic cases, while the rest are severe and critical. A total of 293 people were added to the recovery list, for a total of 524,865, while 44 were added to the death toll, for a total of 12,289. Nine of the 293 new fatalities were previously tagged as recoveries but were later added to the list of those who have died after final validation. Of the 23,011 tests reported on Friday, 1,800 turned out positive, pushing the country’s positivity rate to 7.8 percent. The Philippines is due to receive its first batch of Covid vaccines — 600,000 doses of Sinovac’s CoronaVac — that will be immediately administered to frontline health workers next week."
43,https://www.manilatimes.net/2021/02/27/news/palace-metro-manila-9-other-areas-remain-under-gcq-in-march/845872/,"Catherine S. Valente, TMT","February 27, 2021","Palace: Metro Manila, 9 other areas remain under GCQ in March","METRO Manila and nine other areas in the country will remain under general community quarantine (GCQ) status for the entire month of March, Malacañang announced on Saturday. Palace spokesman Harry Roque Jr. said Duterte on Friday retained the GCQ classification of the National Capital Region, Baguio City and Davao City until March 31. Also under GCQ are, for Luzon, Batangas and some areas in the Cordillera Administrative Region which include Apayao, Kalinga and Mountain Province; Tacloban City for the Visayas; Iligan City and Lanao del Sur for Mindanao, he said. The rest of the country, meanwhile, will be under modified general community quarantine (MGCQ). “The above mentioned risk-level classifications will take effect starting Monday, March 1 until March 31, 2021,” Roque added. The new community quarantine classifications came days after Duterte rejected the proposal to place the country under MGCQ until the country’s Covid-19 vaccination program has started. Nine of 17 mayors in the capital region had backed a shift to MGCQ by March, which marks a year since the country was first placed under quarantine. Metro Manila, which accounts for about a third of the country’s gross domestic product, has been under GCQ since August 2020, with stricter lockdowns enforced in the earlier months as Covid-19 infections rose. To date, the country recorded 568,680 Covid-19 cases, with 524,042 recoveries and 12,201 deaths. The country has yet to receive any Covid-19 shot, with which it hoped to launch its vaccination drive this month, and cover up to 70 million people or two-thirds of the population through the year. The Palace has announced that the first batch of China’s Sinovac Biotech vaccines would arrive in the Philippines on Sunday. The President will personally witness the arrival of the vaccines. The Food and Drug Administration (FDA) recently cleared the Sinovac vaccine for emergency use. However, Sinovac is not recommended for healthcare workers and senior citizens due to its 50 percent efficacy rate. Sinovac is the third vaccine brand to receive emergency use authorization after Pfizer and AstraZeneca vaccines."
