,urls,authors,dates,headlines,contents
91,https://www.manilatimes.net/2021/02/10/news/latest-stories/who-team-coronavirus-unlikely-to-have-leaked-from-china-lab/838856/,Associated Press,"February 10, 2021",WHO team: Coronavirus unlikely to have leaked from China lab,"WUHAN, China: The coronavirus most likely first appeared in humans after jumping from an animal, a team of international and Chinese scientists looking for the origins of coronavirus disease 2019 (Covid-19) said Tuesday, saying an alternate theory that the virus leaked from a Chinese lab was unlikely. A closely watched visit by World Health Organization (WHO) experts to Wuhan — the Chinese city where the first coronavirus cases were discovered — did not dramatically change the current understanding of the early days of the pandemic, said Peter Ben Embarek, the leader of the WHO mission. But it did “add details to that story,” he said at a news conference as the group wrapped up a four-week visit to the city. And it allowed the joint Chinese-WHO team to further explore the lab leak theory — which former US President Donald Trump and officials from his administration had put forward without evidence — and decide it was unlikely. The Wuhan Institute of Virology is home to many different virus samples, leading to allegations that it may have been the source of the original outbreak, whether on purpose or accidentally. Peter Ben Embarek of the World Health Organization team holds up a chart showing pathways of transmission of the virus during a joint press conference held at the end of the WHO mission in Wuhan in central China’s Hubei province on Tuesday, Feb. 9, 2021. (AP Photo/Ng Han Guan) Embarek, a WHO food safety and animal disease expert, said experts now consider the possibility of such a leak so improbable that it will not be suggested as an avenue of future study. But another team member, Danish scientist Thea Koelsen Fischer, told reporters that team members could not rule out the possibility of further investigation and new leads. China had already strongly rejected the possibility of a leak and has promoted other theories. The Chinese and foreign experts considered several ideas for how the disease first ended up in humans, leading to a pandemic that has now killed more than 2.3 million people worldwide. Embarek said the initial findings suggest the most likely pathway the virus followed was from a bat to another animal and then to humans, adding that would require further research. “The findings suggest that the laboratory incidents hypothesis is extremely unlikely to explain the introduction of the virus to the human population,” he said. Liang Wannian, the head of the Chinese side, noted that there was no sample of the virus that causes Covid-19 in the lab — and thus it could not have come from there. The mission was intended to be an initial step in the process of understanding the origins of the virus, which scientists have posited may have passed to humans through a wild animal, such as a pangolin or bamboo rat. Transmission directly from bats to humans or through the trade in frozen food products are also possibilities, Embarek said. The WHO team’s visit is politically sensitive for Beijing, which is concerned about being blamed for alleged missteps in its early response to the outbreak. An AP investigation has found that the Chinese government put limits on research into the outbreak and ordered scientists not to speak to reporters. A WHO-China Joint Study Press Conference is held at the end of a WHO mission to investigate the origins of the coronavirus pandemic in Wuhan in central China’s Hubei province, Tuesday, Feb. 9, 2021. (AP Photo/Ng Han Guan) Still, one member of the WHO team, British-born zoologist Peter Daszak, told The Associated Press last week that they enjoyed a greater level of openness than they had anticipated, and that they were granted full access to all sites and personnel they requested. Koelsen Fischer said she did not get to see the raw data and had to rely on an analysis of the data that was presented to her. But she said that would be true in most countries. The team — which includes experts from 10 countries who arrived on Jan. 14 — visited the Huanan Seafood Market, the site of an early cluster of cases in late 2019. Marion Koopmans, a Dutch virologist on the team, said that some animals at the market were susceptible or suspected to be susceptible to the virus, including rabbits and bamboo rats. And some could be traced to farms or traders in regions that are home to the bats that carry the closest related virus to the one that causes Covid-19. She said the next step would be to look more closely at farms. Liang, the head of the Chinese team, said the virus also appeared to have been spreading in parts of the city other than the market, so it remains possible that the virus originated elsewhere. Marion Koopmans, right, and Peter Ben Embarek, center, of a World Health Organization team look over at their Chinese counterpart Liang Wannian, left, during a WHO-China Joint Study Press Conference held at the end of their mission to investigate the origins of the coronavirus pandemic in Wuhan in central China’s Hubei province, Tuesday, Feb. 9, 2021. (AP Photo/Ng Han Guan) The team found no evidence that the disease was spreading widely any earlier than the initial outbreak in the second half of December 2019. “We haven’t been able to fully do the research, but there is no indication there were clusters before what we saw happen in the later part of December in Wuhan,” Liang said. The visit by the WHO team took months to negotiate. China only agreed to it amid international pressure at the WHO’s World Health Assembly meeting last May, and Beijing has continued to resist calls for a strictly independent investigation. While China has weathered some localized resurgences of infection since getting the outbreak under control last year, life in Wuhan itself has largely returned to normal."
92,https://www.manilatimes.net/2021/02/10/news/national/pasay-city-mayor-contracts-covid-19/838791/,John Eric Mendoza,"February 10, 2021",Pasay City mayor contracts Covid-19,"PASAY City Mayor Emi Calixto-Rubiano on Tuesday confirmed that she tested positive for the coronavirus disease 2019 (Covid-19). Mayor Emi Calixto-Rubiano. Photo from FB account. She said she started experiencing some Covid-19 symptoms prompting her to immediately get a swab test. “Sa resulta, nakita na ako ay nag-positibo sa nasabing sakit (Results have shown that I tested positive for the said disease),” the mayor said in a Facebook post. She added that the results were released on Monday. The mayor said she and others were exposed to a City Hall employee. They were all required to undergo swab tests. Calixto-Rubiano is now in isolation and ordered her personnel to conduct contact tracing on the employees’ close contacts. “The coronavirus does not choose who to infect. Let us not be complacent, but continue to be careful and cautious,” she said. “This likewise highlights the reality that we really need the vaccination, and our continuous prayers to our Almighty God.” The mayor said she would continue to work via teleconferencing and messaging apps. Pasay has 7,137 cases of the new coronavirus, including 80 active cases, 6,873 recoveries and 184 deaths."
93,https://www.manilatimes.net/2021/02/09/news/latest-stories/time-to-wear-a-better-mask-experts-say/838594/,Agence France-Presse,"February 9, 2021","Time to wear a better mask, experts say","WASHINGTON, D.C.: As new, more transmissible variants of the coronavirus spread, experts say it’s time to consider using a medical-grade respirator, or wearing a surgical and cloth mask together. Scientists have agreed for some time the main way the virus is spread is through the air, rather than surfaces, and there’s growing evidence that small droplets from ordinary breathing and speech that can travel many meters (yards) are a common mode of transmission. Added to this is the greater contagiousness of emerging variants, like B.1.1.7, which takes a smaller viral load to cause symptomatic Covid-19 compared to the more common strain. Back when authorities first recommended people wear face coverings, proper masks were in extremely short supply and the public was encouraged to fashion makeshift solutions out of T-shirts or bandanas. But these are far from ideal. Linsey Marr, a professor of civil and environmental engineering at Virginia Tech, who studies airborne disease transmission, told Agence France-Presse: “How well a mask works depends on two things: filtration and fit. “Good filtration removes as many particles as possible, and a good fit means that there are no leaks around the sides of your mask, where air — and viruses — can leak through,” she said, adding even a small gap could lead to a 50 percent reduction in performance. The best materials for blocking small particles include non-woven polypropylene, which is used to make N95s and many surgical-type masks, and the HEPA filters in planes. Among fabrics, tightly woven cotton works best, she added. This illustration shows a woman wearing two facemasks, a cloth mask over a surgical mask, in Arlington, Virginia, on February 8, 2021. AFP PHOTO “If you wear a cloth mask, choose one that has multiple layers, ideally one with a pocket that you can slip a good filter material into,” said Marr. “Or you can double mask by wearing a surgical-type mask with a tight-fitting cloth mask over it.” Surgical masks are made of material that filters things out well, but they tend to be loose, so adding a cloth mask on top holds down the edges and reduces leaks. Adding an additional layer improves filtration —  if one layer traps 50 percent of all particles, combining two gets to 75 percent. But, she added: “We do not recommend wearing more than two masks. Adding more layers proves diminishing returns and can compromise breathability. It must remain easy to breathe through the layers; otherwise, air is more likely to leak in around the sides of the mask.” Masks that have a metal nose bridge help ensure a snug fit, as do straps that tighten around the head, not just the ears. Braces that improve the fit of surgical masks are now available on the market. “You should feel the mask sucking inward when you breathe in, and if you hold your hands around the sides of the mask, you should not feel any air leaking out when you breathe out,” said Marr. In this file photo taken on January 29, 2021 a woman wearing double protective face masks to prevent the spread of Covid-19 waits at a traffic light in Hanoi, a day after Vietnam recorded its first coronavirus outbreak in almost two months. AFP PHOTO Another option is getting hold of N95s, or their international equivalents such as KN95, FFP2 etc. “They all provide a similar level of filtration, meaning protection of particles going in and out,” Ranu Dhillon, a global health physician at Brigham and Women’s Hospital and Harvard Medical School. Dhillon, who has been advocating in favor of better masks since last spring, is frustrated by the lack of clear messaging to the public on the value of better masks. What’s more, “there’s not been a concerted push to really mass produce and mass distribute these higher caliber masks.” Health care workers have their masks professionally fit-tested every year to ensure they’re making the right seal, but Dhillon doesn’t see this as a major obstacle. “To teach people to fit a mask, even if not 100 percent perfectly, but more effectively, is something that’s very doable.” In this file photo taken on December 10, 2020 a man wears a double mask as he visits Times Square in New York. AFP PHOTO The key to conceptualizing the threat is to think of cigarette smoke, said Donald Milton, a professor of environmental health at the University of Maryland. Ventilation definitely helps, but if you’re between a person who is breathing and an exhaust vent, the virus will still reach you — which makes good masks so crucial, he said. Milton and Dhillon are cautiously optimistic that their pleas could soon become policy under the administration of President Joe Biden, and CNN reported last week the US government was working on the first official mask standards. Prior to the pandemic, Milton and other aerosol scientists studying the flu concluded it too is transmitted from tiny droplets from ordinary speaking and breathing, and that the role of sneezing, coughing and transmission from surfaces was smaller than thought. Their findings stirred controversy at the time, but Covid-19 has renewed interest in the research — meaning masks could be a common sight during tough flu seasons, long after the pandemic has receded. "
94,https://www.manilatimes.net/2021/02/09/news/latest-stories/kalinga-gov-tests-positive-for-covid/838592/,None,"March 8, 2021",Kalinga gov tests positive for Covid,"TUGUEGARAO CITY: Kalinga Governor Ferdinand Tubban has announced “with regrets” that he was tested positive for the coronavirus disease 2019 (Covid-19). Kalinga Governor Ferdinand Tubban, Photo from Wikipedia In a Facebook post in the provincial government-maintained site, Tubban, who learned of the result on Monday after taking the real time reverse transcription-polymerase chain reaction (RT-PCR) test, has asked people with whom he had come into contact with in the past week to observe for signs or symptoms of the virus and to consult a health worker. The governor has called on residents to observe minimum health protocols such as washing hands frequently, wearing face mask and face shield and to observe social distancing. It was not immediately known where the governor got the virus. Due to the imposition of the enhanced community quarantine (ECQ) in Tabuk City until February 15, the scholarship renewal of grantees has been postponed indefinitely, according to Mayor Darwin Estranero. The grantees, however, were advised to get their grades and enrollment or assessment form and submit them to the Scholarship Office as soon as schools open after the lockdown. Meanwhile, 116 applications are still pending since May 2020 because the Scholarship Office cannot contact the applicants for an interview due to inactive phone numbers. Uncooperative contacts The municipal health office (MHO) of Lubuagan town in Kalinga is faced with the problem of non-cooperative direct contacts of Covid-19 patients. Mayor Charisma Anne Dickpus urged the public to cooperate in the observance of health protocols and to maintain discipline as a way to combat the spread of Covid-19. Dr. Caroline Agyao, MHO chief, said people who knew they have directly interacted with Covid-19 patients refuse to come forward and cooperate and this has been one of their struggles during contact tracing. “We are begging those that had contact with Covid-19 positive patients to submit themselves. This is also for the protection of the elderly and children who are with them in the same house,” Agyao said. She said some also refuse to reveal their contacts and in one instance resulted in the infection of one of their office staff and that all of them had to be quarantined. “Others even hide and when we conduct random testing in areas identified, we find out that there were those infected with the virus,” Agyao said. Agyao said they welcome the modified enhanced community quarantine (MECQ) status of Lubuagan town because it limits the movement of residents and prohibits them from going in and out of the municipality for non-essential travels. “The extension of the MECQ will also provide them ample time to trace all possible contacts of those who turned positive for Covid-19,” she said. Lubuagan town has recorded a total of 59 cases in the municipality since Nov. 20, 2020 with a total of 36 active cases and 23 recoveries as of February 7."
95,https://www.manilatimes.net/2021/02/07/business/sunday-business/execs-work-life-balance-vital-amid-covid/837787/,Faye Almazan,"February 7, 2021",Execs: Work-life balance vital amid Covid,"Foreign-born corporation chiefs in the Philippines have stressed the importance of maintaining a work-life balance after the coronavirus pandemic disrupted business operations and changed the work arrangements of employers and employees alike. This emerged during a webinar of the French Chamber of Commerce on Wednesday, where these company heads highlighted the vital role of sports and mental health in easing the stress caused by the current working environment, which sees many people still working from home. For Dr. Amal Makhloufi Benchouk, Sanofi Philippines general manager and country chairman, keeping a work-life balance is crucial for a sound body and mind. She said it was important to take care of one’s self, especially since the boundary between the workplace and home had been blurred. According to her, some of the things she does to sustain that balance are setting up specific work times; discouraging meetings during lunch breaks; and dedicating her free time to exercising, learning new skills and her family. She said measures that Sanofi had implemented to ensure the health of its employees included adopting a flexible working scheme, setting a specific time for calls to avoid “Zoom fatigue” and regularly working out to promote physical fitness. The company also launched an employee assistance program that aims to provide workers and their families with services like counselling for both personal and professional situations. “As we go on with our daily lives amid the pandemic and beyond, I would like to prescribe a healthy dose of self-care, which I believe is the best medicine for both our mental and physical health,” Benchouk said. Meanwhile, Decathlon Philippines Chief Executive Officer Hans Iff said sports was important in maintaining a healthy lifestyle. According to him, sports could help release positive hormones that could make one feel happier, relaxed and sensible. Iff also shared a few tips that could help people improve their lifestyle, including creating a routine, keeping some moments to themselves and setting reachable targets. One should learn to listen to one’s body and know one’s limitations, according to him as he emphasized the importance of getting good sleep. For Jones Lang LaSalle Country Head and CCI France Philippines President Cristophe Vicic, the pandemic accelerated his company’s well-being strategy for employees. “The JLL vision is that we want our people to feel supported, engaged and healthy,” Vicic said. According to him, this vision is built on four pillars: mental well-being, physical well-being, financial well-being and inclusion in the workplace. Vicic also attested to his experiences in marathons as having helped him in his career and how he applied the principles of preparing for race in his life and career. For more, watch the edited version of the webinar at The Manila Times YouTube channel: https://youtu.be/PF033nYyid4."
96,https://www.manilatimes.net/2021/02/06/news/latest-stories/pal-offers-to-transport-vaccines-from-europe-us/837739/,"Benjamin L. Vergara, TMT","February 6, 2021","PAL offers to transport vaccines from Europe, US",“The PAL team has been part of the cold chain logistics team organized by Secretary (Carlito) Galvez in the distribution of vaccines.”
97,https://www.manilatimes.net/2021/02/04/news/latest-stories/ph-records-1590-new-covid-19-cases/837158/,Red Mendoza,"February 4, 2021","PH records 1,590 new Covid-19 cases","THE Philippines recorded 1,590 cases of the coronavirus disease 2019 (Covid-19) on Thursday, according to the Department of Health, increasing the number of infections to 531,699. Of the 32,775 active cases, more than 95 percent are mild, moderate and asymptomatic, while the rest are severe or critical. There are 487,927 recoveries, including 249 new survivors. The death toll is at 10,997 with 55 new fatalities. The country’s positivity rate is at 5.8 percent with 1,428 testing positive for the virus out of the 24,7691 samples sent to laboratories nationwide."
