,urls,authors,dates,headlines,contents
68,https://www.manilatimes.net/2021/02/19/opinion/columnists/secure-and-insecure-citizenship/842604/,Stephen CuUnjieng,"February 19, 2021",Secure and insecure citizenship,"I WAS debating whether to write another article on Covid-19 having first read a very intelligent article in The Atlantic and given the misinformation being peddled by others. There are those who for their personal reasons have an ideological bias that overcomes fact and reason, but I decided against another article that would marginally be bringing up new points given all the major ones that have already been set forth. Maybe if it was substantially on points not previously raised or new verified information rather than rehashing whatever one’s bias dictates and quoting prejudiced sources. On the topic, I am not discussing what is the way we should apply our citizenship laws. While I did work at the Romulo Law Office and passed the bar, my legal career ended in 1984, and I do not pretend to be up to date or remember enough of what I was ably taught decades ago. This is about our attitude toward citizenship and contrast that with others. Many may take issue with my observations, but that is what reasoned discourse is about. I have observed that generally, the more secure a country is, the more liberal their citizenship laws. The less differences in citizenship rights between natural and naturalized, the more open-minded their attitude toward citizenship is. Same is true on how straightforward and open the country is to naturalization. An exception to this is Japan, where like the Philippines one only gets citizenship through jus sanguinis (bloodline — so a parent must be a citizen to bestow citizenship on a child) vs jus soli (where you are born). Places like the US and UK give both jus sanguinis and soli. In Japan you have people who legally work and stay there for generations but because of bloodline never become citizens. That would be the case here as well unless you opt for naturalization. Ironically, it often seems the stricter the citizenship laws, the less desirable the country often is for citizenship anyway. These tend to be the jus sanguinis only countries. Jus soli or jus sanguinis
Why do countries like the US (though the nativist and racist Trump talked about changing it and fortunately his losing ends that immediate fear) apply jus soli? Why do they grant citizenship if you were born there and have for immigrants a relatively straightforward path to citizenship? First, these tend to be countries that had high immigration in their formative years and encouraged it (though the US also has swung the other way under Trump and had its shameful racist periods like the Chinese Exclusion Act and the Japanese incarceration in times of backlash and xenophobia). Second, they tend to be successful and secure countries that argue if you stay here it is because you want to and believe it, to use the popular phrase, to be “the land of opportunity.” Let us not digress into talk among elites who argue about their privileges and so on here vs there. I am talking about opportunity in spite of challenges overall. Those countries are generally not worried that you are going there to exploit the country. You are going there to be part of it. You have bought into their narrative or at least believe that for all the challenges, the opportunities there are better than back home. My one digression that really gets me angry is when people tout the Philippines as paradise because you can have maids and personal help en masse. Guess what? Maybe it is paradise for those who have maids. It is far from paradise for the ones rendering the service. To many and I agree, it is a sign of advancement and civilization that there are enough opportunities in a country that many do not have to be domestic help and if they do so, are compensated enough so it is at least partially a choice rather than something one does for lack of choice or to survive. A paradise is one that is paradise for all or most. Not some tiny sliver only. When my family and I lived in the US, we had no live-in or full-time help. If you needed or wanted someone to come in to clean the house or mow the lawn you contracted with a service, and they would come over, often as a team and do what they needed to in a few hours and then would come back depending on your schedule weekly or as one needed or scheduled. In New York City, it is often an individual rather than a team given most have apartments. Also, the society is structured so you do not need live-in or permanent help to have a comfortable life. The only exception is if you have very young children; then the need to arrange reliable baby-sitters is a chore and can be a challenge. Hence one often sees parents bringing their infants with them to restaurants, cinemas and the like. Related to this is the comment I often hear which is, why do Filipinos do well when abroad? I think it is in large part that our country, 75 years after independence, has not delivered for its ever-increasing population. In our region, Malaysia and Thailand have and Vietnam is clearly on its way to doing so. I remember being so proud after 1986 and so sad for China after 1989. Let us be blunt, absent surface political rights (and I say surface and superficial because who really benefits and can make use of our democratic rights), who is better off if we take conditions prevailing in 1990 as the starting point? On both an individual and country level — the Philippines or China? The answer except for political dissidents is so sadly and blatantly obvious. To go back to the question, why do Filipinos do well abroad while the country underperforms? I used to say, the biggest vote in the Philippines is not the vote for this or that candidate. It is the vote to leave, which tens of millions of Filipinos have taken and continue to take. In my view, Filipinos do well abroad for two reasons — simply because they are incentivized to do so and generally those who go abroad are the more aggressive and adventurous ones. Let us assume you are in a middle position, not happy but not unhappy. Which type of person chooses to stay and which chooses to try something different elsewhere? Who is willing to be away from their families, friends, comfort zone and environment? The latter might not be smarter or wiser and it may be the wrong decision, but that person is definitely more adventurous and open to new ideas and challenges. Guess what? That is what they say in other countries as well, where there is a diaspora until the home country becomes successful and many return home. Natural-born vs naturalized
An offshoot of this is the different rights of natural-born and naturalized citizens. In the US, I think the only differentiator I know is that only a natural-born citizen can be president and if there was fraud in the naturalization process, citizenship can be rescinded. A natural-born citizen cannot have this citizenship removed or revoked. The US requires certain industries like media and transportation and their CEOs to be American. They do not distinguish between natural and naturalized. When he bought the New York Post decades ago, Rupert Murdoch acquired American citizenship to enable himself to be a publisher. Same thing with elected and appointed government officials below president. There was even some fringe speculation during Watergate after VP Agnew resigned that Nixon appointed Kissinger who was a naturalized citizen as vice president as he could not run for and be elected president but if Nixon resigned, he could become president. Don’t know if that view was accurate and many who detest Kissinger would have been aghast if it had happened, but it did not come to pass. Yet some writers speculated on it. Dual citizens
This is another thing secure countries are relaxed about. Mark Carney was the governor of the Central Bank of Canada from 2008 to 2013. Having done an exemplary job and being a dual citizen of Canada and the United Kingdom, he was then made governor of the Bank of England from 2013 to 2020. Economist Stanley Fischer, who was born in what is now Zambia (the former Northern Rhodesia) has dual citizenship — Israeli and American. He was chief economist of the World Bank, then from 2005 to 2013 was governor of the Bank of Israel. In 2014, President Obama appointed him vice chairman of the Federal Reserve. He stepped down for personal reasons in 2017. Jennifer Granholm is both a Canadian and naturalized American citizen and was born in Canada. She was elected and served as governor of Michigan from 2003 to 2011 and has now been appointed secretary of energy by President Biden. What is my point behind these examples? The US, the UK, Canada and Israel did not care if they were dual citizens or naturalized. They just wanted the best and most qualified citizens. Why exclude citizens based on having more than one citizenship or being naturalized? I would suggest in a country like ours, where so many left for opportunity and necessity, why discriminate against them if they want to engage in public service when they return? Recovery of citizenship was a good step but why be so insecure and stop there? The same for naturalized citizens. You must really want to be part of the country if you take an actual step of taking citizenship. If one argues but they left or they got naturalized for opportunistic reasons, my answer is so what? If they are lousy or disloyal, then remove them or vote them out. Are we that insecure? Or jealous?"
69,https://www.manilatimes.net/2021/02/18/second-headline/un-chief-urges-global-plan-to-reverse-unfair-vaccine-process/842341/,Associated Press,"February 18, 2021",UN chief urges global plan to reverse unfair vaccine process,"UNITED NATIONS: UN Secretary-General Antonio Guterres sharply criticized the “wildly uneven and unfair” distribution of coronavirus disease 2019 (Covid-19) vaccines on Wednesday, saying 10 countries have administered 75 percent of all vaccinations and demanding a global effort to get all people in every nation vaccinated as soon as possible. The UN chief told a high-level meeting of the UN Security Council that 130 countries have not received a single dose of vaccine and declared that “at this critical moment, vaccine equity is the biggest moral test before the global community.” Guterres called for an urgent Global Vaccination Plan to bring together those with the power to ensure fair vaccine distribution — scientists, vaccine producers and those who can fund the effort. The secretary-general called on the world’s major economic powers in the Group of 20 to establish an emergency task force to establish a plan and coordinate its implementation and financing. He said the task force should have the capacity “to mobilize the pharmaceutical companies and key industry and logistics actors.” Guterres said Friday’s meeting of the Group of Seven major industrialized nations “can create the momentum to mobilize the necessary financial resources.” British Foreign Secretary Dominic Raab, whose country holds the Security Council presidency this month, urged the UN’s most powerful body to adopt a resolution calling for ceasefires in conflict zones to allow the delivery of Covid-19 vaccines. Thirteen ministers were scheduled to address the meeting on improving access to Covid-19 including US Secretary of State Antony Blinken. Britain says more than 160 million people are at risk of being excluded from coronavirus vaccinations because they live in countries engulfed in conflict and instability, including Yemen, Syria, South Sudan, Somalia and Ethiopia. “Global vaccination coverage is essential to beating coronavirus,” Raab said ahead of the meeting. “That is why the UK is calling for a vaccination cease-fire to allow Covid-19 vaccines to reach people living in conflict zones and for a greater global team effort to deliver equitable access.” Britain’s UN ambassador, Barbara Woodward said: “Humanitarian organizations and UN agencies need the full backing of the council to be able to carry out the job we are asking them to do.” Woodward said cease-fires have been used to carry out vaccinations, pointing to a two-day pause in fighting in Afghanistan in 2001 that enabled 35,000 health workers and volunteers to vaccinate 5.7 million children under the age of 5 against polio. Britain has drafted a Security Council resolution that Woodward said the UK hopes will be adopted in the coming weeks. Mexican Foreign Minister Marcelo Ebrard said Tuesday that Mexico will stress the importance of equal access for all countries to Covid-19 vaccines at the council meeting. He was sharply critical that countries that produce the vaccine have high vaccination rates while Latin American countries have problems obtaining any vaccines. The coronavirus has infected more than 109 million people and killed at least 2.4 million of them. But many countries have not yet started vaccination programs and even rich nations are facing shortages of vaccine doses as manufacturers struggle to ramp up production. The World Health Organization’s COVAX program, an ambitious project to buy and deliver coronavirus vaccines for the world’s poorest people, has already missed its own goal of beginning coronavirus vaccinations in poor countries at the same time that shots were rolled out in rich countries. Numerous developing countries have rushed in recent weeks to sign their own private deals to buy vaccines, unwilling to wait for COVAX. Woodward said Britain supports reserving 5% of COVAX doses as a “last resort” buffer to ensure that high-risk populations have access to Covid-19 vaccines."
70,https://www.manilatimes.net/2021/02/18/campus-press/are-supervisors-still-relevant-in-the-next-normal/842225/,"Ernie Cecilia, DPM","February 18, 2021",Are supervisors still relevant in the next normal?,"Almost a year ago, Josh Dzieza, investigations editor and feature writer at “The Verge,” wrote an article that could scare today’s Supervisors. The handwriting on the wall looks clear, “In warehouses, call centers and other sectors, intelligent machines are managing humans, and they’re making work more stressful, grueling, and dangerous.” Robo-bosses
Dzieza continues, “The robots are watching over hotel housekeepers, telling them which room to clean and tracking how quickly they do it. They’re managing software developers, monitoring their clicks and scrolls and docking their pay if they work too slowly. They’re listening to call center workers, telling them what to say, how to say it, and keeping them constantly, maximally busy. While we’ve been watching the horizon for the self-driving trucks, perpetually five years away, the robots arrived in the form of the supervisor, the foreman, the middle manager.” Robotics and AI (artificial intelligence) have arrived, and workers in many countries are worried. Dzieza said, “For many of them, their greatest fear isn’t that robots might come for their jobs: it’s that robots have already become their boss.” While many employees detest the thought of being supervised by a robot, a recent survey by Kevin Kruse, CEO of LEADx, revealed that more than 20 percent of workers would want to replace their boss with a generic robot. The LEADx survey results could be unsettling for some supervisors, considering that supervisors have come a long way since the medieval times and have been permanent fixtures in today’s workplace. Origin of supervisor
According to Wikipedia, the word “supervisor” came from the Medieval Latin verb “supervidēre,” meaning “to oversee.” The prefix super (also supra) means “over” or “above”, while the Latin vidēre means “to see.” Literally, to supervise means to see from above. The supervisor is also known by several names — foreman, boss, overseer, monitor, area coordinator or sometimes “gaffer.” In the factory, the supervisor is in a low-level management position. In the academe, the supervisor could be one of the most senior in the staff, such as a Professor who oversees a PhD dissertation. Sometimes, people in the same job grade as the Supervisor are also classified as supervisors, even if they do not supervise other people. Supervisors’ dilemma
Perhaps, supervisors are one of the most misunderstood and stressed people in the workplace. They have productivity-conscious bosses above them and sometimes uncooperative subordinates below them. They’re like the “bibingka,” the Filipino rice cake cooked with fire under it and burning coal on top of it. The first time I was promoted to be a supervisor came as a surprise. I had no training to be one. It seemed that my boss perceived how good I was at doing my clerical tasks. As a reward, I was promoted! Then my headaches began. Here’s why: Like I said, I never had any supervisory skills training before I got promoted. It felt like I was thrown into the pool, and I heard my boss shouting, “Swim!” I was good at technical work, but I never did management or supervisory work. The scope of my job was unclear at first. My friends and fellow employees suddenly became my subordinates. I was not sure if they were ready to accept me as their boss. My sense sometimes told me that some, not all, resented my promotion since many of them had more seniority and longevity in the company. Suddenly, I had two jobs — doing my own and minding the jobs of others. Somehow, I thought that I was programmed to be a rank and file. I had to reprogram my thinking and thought process to be like a manager. It was tough without support from my Manager. To those supervisors who now experience the same dilemma I encountered early in my career, here are some suggestions you might find useful: – Role clarification. First understand your new role — including what you’re supposed to do and what you’re not supposed to do. Ask your boss about his/her expectations and the limits of your authority. Once you’re clear on the parameters with your boss, clarify the same with your subordinates. Whenever possible, take time to discuss this with your subordinates as a group and on a one-on-one basis. Listen to their reactions — verbal and nonverbal — and to what is not being said. – Remain professional at all times. As a new “boss,” you need to establish professional working relationships with your bosses, peers and subordinates. Focus on issues and the tasks at hand, rather than on personalities. Do not shoot the messenger who brings you unsavory news. Be seen as a leader and enabler of others – not bossy, not pushing too hard. – Refrain from office politics. At all cost, avoid corridor or water-cooler politics. Do not side with one party to a dispute that you must arbitrate. Remain neutral, objective and fair always. Don’t get tempted to listen to juicy gossip, lest one day you’re subject of it, too. – Raise your managerial skills. Always sharpen your saw, as Covey said. While the management principles hardly change, the practice is influenced by a number of change drivers in business and in life. Continue to be a student of the art and science of management. Learn the science and adapt it to your working environment. C-3PO as boss?
First-time supervisors must not be wary about lack of supervisory, managerial or leadership skills. They are easily learned from the right sources. What is more worrisome is the development in technology that enables the machines to take over the supervisors’ jobs. The other aspect to worry about is the reaction of workers to the idea of changing a human supervisor with a robot. The younger employees are more willing and ready to trade their current boss with C-3PO. Many employees join a company. But Gallup says employees resign from their bosses. The Gallup survey speaks volumes. Bad bosses are perhaps the major reason for low employee engagement. The LEADx survey says that roughly 30 percent of employees would replace their boss with a friendly humanoid robot-like C-3PO. Recent employee engagement surveys confirm that 30 percent of employees worldwide are disengaged. Coincidence? The LEADx survey revealed the main reasons why employees would replace their bosses with robots: a) they don’t like their boss; 2) their boss is biased; 3) their boss lacks competence; and 4) their boss lacks people skills and empathy. The onus is on supervisors to prove that they are still relevant in the workplace now and in the future. Obviously, humans have characteristics that robots still don’t have, as we write. If the developers and programmers can find a way to program empathy, compassion and love into the DNA of the robots, the supervisors would be among the endangered species. The surveys tend to send a strong warning. People, especially the young, are willing to work with technology, especially in humanoid form, perhaps like Daryl (Data Analyzing Robot Youth Lifeform) in the 1985 movie. People will prefer to have a robot boss if it means getting rid of their bad supervisor. To good supervisors, I say that there’s still a niche for you. As Brian Tracy said, “Only about two percent of people can work entirely without supervision. We call them Leaders.” To the employees, I reiterate my long-time admonition, “Take care of your boss now, the next could be worse — or not human.” Ernie Cecilia is the chairman of the Human Capital Committee of the American Chamber of Commerce of the Philippines (AMCHAM); Co-Chairman of the Employers Confederation of the Philippines’ (ECOP’s) TWG on Labor Policy and Social Issues; and past president of the People Management Association of the Philippines (PMAP). He can be reached at erniececilia@gmail.com"
