,urls,authors,dates,headlines,contents,news_agency
4,https://www.philstar.com/nation/2021/03/07/2082521/1094-pnp-medical-frontliners-get-sinovac-jabs,Emmanuel Tupas,2021-03-07,"1,094 PNP medical frontliners get Sinovac jabs","MANILA, Philippines — A total of 1,094 healthcare frontliners of the Philippine National Police (PNP) have been vaccinated against COVID-19 as of yesterday.PNP deputy chief for administration Lt. Gen. Guillermo Eleazar said the 209 medical frontliners on Friday took the jabs developed by Chinese drug firm Sinovac Biotech.Nine experienced mild adverse side effects such as headache, skin rashers, palpitation and dizziness since the PNP started its vaccination program last Monday. Eleazar said these symptoms are minor and did not require hospitalization.At least 1,268 PNP medical frontliners have expressed willingness to be inoculated with Chinese vaccines. The government has increased the allocation of vaccines to the police force from 800 to 1,200 doses.A total of 11,613 PNP members have contracted COVID-19 since last year. Thirty-one died while 11,037 or 95.04 percent of the patients recovered from the disease.At least 545 other police personnel are still battling COVID-19 in hospitals and quarantine facilities.",Philstar
5,https://www.philstar.com/nation/2021/03/07/2082526/ilocos-cordilleras-roll-out-sinovac-vaccines,Raymund Catindig,2021-03-07,"Ilocos, Cordilleras roll out Sinovac vaccines","MANILA, Philippines — Hundreds of health workers in Ilocos and the Cordilleras were inoculated with Sinovac vaccines from China yesterday as the two regions kicked off their anti-COVID vaccination program.Norman Rabago and Walberg Samonte, COVID-19 consultant and director of the Governor Roque Ablan Memorial Hospital in Laoag City, respectively, are the first doctors in Ilocos who were vaccinated.Infectious disease specialist Dr. Criselda Ciubal was the first to receive the Sinovac jab among health workers at the Laoag City General Hospital.Pediatrics specialist Dr. Agnes Dimacalo of the Region 1 Medical Center was the first to be vaccinated in Pangasinan.A vaccine rollout was also held at the Ilocos Training and Regional Medical Center in San Fernando City, La Union.The inoculations against COVID-19 in Ilocos is expected to be completed in five days.Dr. Meliarazon Dulay, acting chief of the Benguet General Hospital, was the first to be injected in the province.Doctors Edrian Geronimo and Daisy Mae Tagudar, heads of the infectious disease and internal medicine departments in the hospital, respectively, were also inoculated.In Mountain Province, the head of the Luis Hora Regional Memorial Hospital (LHRMH) in Bauko town, Dr. Eduardo Calpito, was the first to be vaccinated.Of the 1,040 doses delivered in Mountain Province, 600 are allocated for LHRMH and 200 for Bontoc General Hospital.The vaccination program in Kalinga will start today.The Department of Health turned over 300 doses of Sinovac vaccines to the Kalinga provincial health office on Friday.The second batch of Sinovac vaccines is expected to be delivered after 28 days.Meanwhile, Bulacan received 900 doses of Sinovac vaccines yesterday.Hjordis Celis, head of the response cluster of the provincial task force against COVID-19, said health workers of the Bulacan Medical Center as well as district hospitals would be given priority in the vaccine rollout tomorrow.The vaccinations will be held at the Hiyas ng Bulacan Convention Center in Malolos.Swab tests still requiredAs this developed, Negros Oriental Gov. Roel Degamo said visitors are still required to undergo swab test upon arrival in the province.Degamo said those with negative results would be allowed to go home while those who tested positive for the virus would be brought to isolation facilities.While he acknowledged the more relaxed travel protocols issued by the Inter-Agency Task Force for the Management of Emerging Infectious Diseases, the governor stressed the need to control the spread of COVID-19 in the province.Negros Oriental logged 120 active cases on Friday. – Ramon Efren Lazaro, Gilbert Bayoran",Philstar
6,https://www.philstar.com/headlines/2021/03/07/2082545/dont-waste-hope-vaccines-who-warns,None,2021-03-07,"Don’t waste the hope of vaccines, WHO warns","COVAX will distribute 14.4 million COVID-19 vaccine doses to 31 more countries this week, the World Health Organization (WHO) said Friday as it warned people not to waste, through complacency, the hope that vaccines bring.The COVAX global vaccine-sharing facility shipped more than 20 million doses to 20 countries as the scheme aimed at ensuring poorer nations get access to jabs took off last week.But the WHO voiced fears that further waves of the coronavirus pandemic could be on the way if people think the roll-out of vaccines around the globe means the crisis is over.“The arrival of vaccine is a moment of great hope. But it potentially also is a moment where we lose concentration,” WHO emergencies director Michael Ryan told a press conference.“I really am very concerned that... we think we’re through this. We’re not.“And countries are going to lurch back into third and fourth surges if we’re not careful.“We should not waste the hope that vaccines bring... by dropping our guard in other areas.”WHO director-general Tedros Adhanom Ghebreyesus praised the first full week of the COVAX roll-out, but said wealthy countries were nonetheless still leaving others behind in the vaccination rush.Within Africa, Angola, the DR Congo, The Gambia, Ghana, Ivory Coast, Kenya, Lesotho, Malawi, Mali, Nigeria, Rwanda, Senegal, Sudan and Uganda have now received their first doses through COVAX.Elsewhere, Cambodia, Colombia, India, Moldova, the Philippines and South Korea have also taken deliveries.“In the next week, COVAX will deliver 14.4 million doses to a further 31 countries. That brings the total number of countries to 51,” said Tedros.“This is encouraging progress, but the volume of doses being distributed through COVAX is still relatively small.”He said the first round of allocations, running until the end of May, only covered between two and three percent of the population in recipient states, “even as other countries make rapid progress towards vaccinating their entire population within the next few months.”He called for vaccine production to be urgently ramped up, including through linking manufacturers with rival companies that have spare capacity.Tedros also said the planet would be feeling the mental scars from the pandemic for years to come and said the scale of its impact would be worse than during the recovery from World War II.“The whole world is affected. Each and every individual. That means mass trauma which is beyond proportion. Even bigger than what the world experienced after the Second World War,” he said.“And when there is mass trauma it affects communities for many years to come. Countries have to see it as such and prepare for that. Mass, mass trauma.”Brazil fearsMeanwhile Tedros voiced alarm about the coronavirus situation in Brazil, where cases and deaths have shot up, bucking the global trend.He said that in the week beginning Nov. 2, there were 114,000 new cases in Brazil – a figure that hit 374,000 in the week of Feb. 22.Tedros said the number of deaths had also shot up from 2,500 to 8,000 over the same time period.“The situation is very serious and we’re very concerned, and the public health measures that Brazil takes should be aggressive while also rolling out vaccines,” he said. “Brazil has to take this very, very seriously.”He said that because Brazil bordered so many other countries, the situation there threatened the entire South American continent.Ryan said the P1 variant – which has now been found in 29 countries – had become dominant in Brazil, adding to its woes.He said basic public health measures were still the “best bet” in trying to control case numbers.“Our risk, to an extent, is still in our hands,” Ryan said.But he added that it was very hard in countries like Brazil with large urban populations to take measures like physical distancing and mask-wearing “where they don’t have the resources to do that without the support of the state.”",Philstar
7,https://www.philstar.com/cebu-news/2021/03/07/2082634/deped-encourages-cebu-teachers-get-vaccinated-versus-covid-19,Le Phyllis F. Antojado,2021-03-07,DepEd encourages Cebu teachers to get vaccinated versus COVID-19,"CEBU, Philippines —  The Department of Education (Dep-Ed) Cebu Province is encouraging its teachers to get vaccinated against COVID-19 once the vaccine is available to them, especially with DepEd preparing for the possibility of limited face-to-face classes in the coming months.While medical experts have pushed for every Filipino to get vaccinated, Dr. Marilyn Andales, DepEd Cebu Province School Division Superintendent, said the best that DepEd can do is encourage teachers as respect to their individual rights.""Dili man sila pugson... encouraged lang kay naa man pod nay right,"" Andales said.She said teachers in the province have mixed reactions about the vaccine and there are those who are hesitant to get vaccinated.""Naa pud, natural feelings labi na naa kay existing nga mga sakit… kuan sila, apprehensive what might be the effect kung naa, unya naa ko ani nga sakit… Pero naa po’y isog naa pod uban ganahan,"" Andales told reporters at the sidelines of the Enhanced Countryside Development (ECD) program launched by the Cebu Provincial Government in Pinamunganan town, on March 5.With the national government looking at easing more restrictions as the vaccination program rolls out, Andales said they have identified 12 public schools in different local government units where limited face-to-face classes may be piloted.The list, though, is still being finalized, as there are schools that have backed out after their LGU recorded cases recently.""Sa ilang place sauna, wala to sila, COVID-free, but because nisulat sila nga increasing ilahang COVID cases, so ni-decline sila to be a pilot school sa limited face to face,"" Andales said.She said DepEd is drafting the guidelines in the implementation of the face-to-face classes so that transition will be easier once President Rodrigo Duterte gives the go signal.More AstraZenecaMeanwhile, more doses of the COVID-19 shot developed by British-Swedish drugmaker AstraZeneca with the University of Oxford, will arrive in the Philippines tonight, said vaccine czar Carlito Galvez said.Galvez said 38,400 doses of the jab would arrive at around 7 p.m. on board a commercial plane.These doses form part of the World Health Organization-led COVAX Facility’s pledge to initially deliver 525,600 doses to the Philippines as part of its commitment to give the country a total of 4.5 million doses of the shot by May.Malacañang announced initially that all 525,600 doses would arrive on March 1, only for this to be delayed to March 4 due to supply and logistical problems, which resulted in only 487,200 doses landing in the country.Speaking to health workers at the Ospital ng Parañaque, Galvez said all 525,600 doses did not arrive at the same time because a commercial plane was used for its delivery.The Philippines expects to receive up to 9.2 million doses of AstraZeneca’s coronavirus vaccine this year through the COVAX facility, which ensures that developing countries get access to the coveted drug.The doses from the COVAX facility is on top of the 17 million procured by the national government, local governments and the private sector, which are expected to arrive later this year.AstraZeneca’s shot, which has secured emergency use approval from the Food and Drug Administration, is found to be 70 percent effective on average and only need to be stored at standard fridge temperatures of 2°C.A member of the private research firm OCTA warned, however, that the shot’s efficacy could decrease to just 10 percent against the new coronavirus variant first identified in South Africa — 58 cases of which have already been detected in the Philippines.The health department sought to soothe those fears, saying that the studies cited only used a small sample of individuals, although it did say that the variant from South Africa, known as B.1.351, “may have an impact on vaccine efficacy.”The World Health Organization (WHO) stands by the use of AstraZeneca vaccine after a preliminary study suggested the jab offered less protection against B.1.351.ModernaAside from the AstraZeneca vaccine, about 20 million doses from US biotechnology company Moderna are expected by the end of May or early June, Ambassador to the US Jose Manuel Romualdez said Saturday.The Moderna vaccine has, so far, shown a 94 percent efficacy, higher than either that of Sinovac or AstraZeneca which arrived in the past week.At a Laging Handa briefing, Romualdez said the Philippines is also likely to get 117,000 doses of Pfizer’s COVID-19 vaccine from the COVAX Facility, initiated by WHO.American company Johnson and Johnson has also allocated six million of its COVID-19 vaccine to the Philippines, he added.Overall, the Philippines is expected to receive over 40 million doses of COVID-19 vaccines from the US and the United Kingdom this year, Romualdez and British Ambassador Daniel Pruce said in separate interviews.- Philstar.com, JMO (FREEMAN)",Philstar
8,https://www.philstar.com/headlines/2021/03/06/2082410/more-astrazeneca-vaccines-arriving-philippines-sunday,Xave Gregorio,2021-03-06,More AstraZeneca vaccines arriving in Philippines on Sunday,"MANILA, Philippines — The Philippines is set to receive Sunday evening more doses of the COVID-19 shot developed by British-Swedish drugmaker AstraZeneca with the University of Oxford, vaccine czar Carlito Galvez said.Galvez said 38,400 doses of the jab would arrive in the Philippines at around 7 p.m. onboard a commercial plane.Related StoriesAfter delays, first AstraZeneca jabs from COVAX arrive in PhilippinesPhilippines detects 83 more cases of coronavirus variants first seen in UK, South AfricaThese doses form part of the World Health Organization-led COVAX facility’s pledge to initially deliver 525,600 doses to the Philippines as part of its commitment to give the country a total of 4.5 million doses of the shot by May.Malacañang initially announced that the all 525,600 doses would arrive on March 1, only for this to be delayed to March 4 due to supply and logistical problems, which resulted in only 487,200 doses landing in the country.Speaking to health workers at the Ospital ng Parañaque, Galvez said all 525,600 doses did not arrive at the same time because a commercial plane was used for its delivery.The Philippines expects to receive up to 9.2 million doses of AstraZeneca’s coronavirus vaccine this year through the COVAX facility, which ensures that developing countries get access to the coveted drug.The doses from the COVAX facility is on top of the 17 million procured by the national government, local governments and the private sector, which are expected to arrive later this year.AstraZeneca’s shot, which has secured emergency use approval from the Food and Drug Administration, is found to be 70% effective on average and only need to be stored at standard fridge temperatures of 2°C.A member of the private research firm OCTA, however, warned that the shot’s efficacy could decrease to just 10% against the new coronavirus variant first identified in South Africa — 58 cases of which have already been detected in the Philippines.The health department sought to soothe those fears, saying that the studies cited only used a small sample of individuals, although it did say that the variant from South Africa, known as B.1.351, “may have an impact on vaccine efficacy.”The World Health Organization stands by the use of AstraZeneca vaccine after a preliminary study suggested the jab offered less protection against B.1.351.",Philstar
9,https://www.philstar.com/cebu-news/2021/03/06/2082453/city-chooses-astra-covovax,Caecent No-ot Magsumbol,2021-03-06,"City chooses Astra, Covovax","CEBU, Philippines — Cebu City has submitted letters of intent to purchase COVID-19 vaccines from AstraZeneca and Covovax.“Ato nang gipada sa duha, AstraZeneca and Covovax,” said Mayor Edgardo Labella yesterday.The city sent the letters after the City Council authorized Labella to do so. Vice Mayor Michael Rama, the city’s vaccine convenor, presides over the Council.The city chose AstraZeneca and Covovax for their efficacy and cost, as well as storage consideration. AstraZeneca already has an Emergency Use Authorization from the country’s Food and Drug Administration. Covovax’s EUA is still pending.Labella said this is not the first time that the city communicated with AstraZeneca but this is the first time that it formalized its intent with the Council authorization. Negotiations are being handled by Rama and the city’s vaccine board.Initially, the city government will use P100 million of its P400 million budget for vaccines.  It will purchase more depending on the progress of the national government’s orders and will add budget when necessary.The city is also open to purchasing other vaccine brands, but only after these brands can get an EUA.In an earlier report, Sinovac is among three vaccines the city has considered for its own vaccination program. However, it decided to let go of Pfizer-BioNtech, the first vaccine to be given an EUA in the country, mainly due to storage concernsLabella said he will have himself vaccinated, as long as it is safe for senior citizens, as soon as the vaccine arrives.“Ako, magpabakuna gyud ko because this is the one of the ways that we can go back to normal,” Labella said.He said the city can also hold its own simulation of the vaccination program just like what Lapu-Lapu did.Based on the March 4, 2021 data from the Department of Health (DOH)-7, Cebu City has 3,316 active cases with 143 more logged that day. — JMO (FREEMAN)",Philstar
10,https://www.philstar.com/headlines/2021/03/05/2082189/top-covax-donors-us-eu-welcome-arrival-astrazeneca-jabs-philippines,None,2021-03-05,"Top COVAX donors US, EU welcome arrival of AstraZeneca jabs in Philippines","MANILA, Philippines — Major contributors to the World Health Organization co-led COVAX facility welcomed the arrival of AstraZeneca vaccines in the Philippines.After delays, 487,200 doses of the vaccine produced by the Swedish British drugmaker arrived in the country on Thursday night.Related StoriesAfter delays, first AstraZeneca jabs from COVAX arrive in PhilippinesDistribution of AstraZeneca COVID-19 vaccines to hospitals may begin Friday — officialBoth the United States and the European Union welcomed this latest development.The US Embassy in Manila said it has initially donated P97.2 billion ($2 billion) to COVAX ""to ensure the Philippines and other countries receive COVID-19 vaccines.“The United States is proud to be the largest contributor to COVAX, and we welcome the successful arrival of the first tranche of AstraZeneca vaccines in the Philippines. As we fight the pandemic together, the United States will continue to support the Philippines’ vaccination and COVID-19 mitigation efforts,” US Chargé d’Affaires John Law said in a statement released Friday.The U.S. welcomes the arrival of 487,200 doses of AstraZeneca COVID-19 vaccine from the COVAX facility in the Philippines on Mar. 4. The U.S., through USAID, has donated Php97.2 billion ($2B) to COVAX as part of a total $4 billion U.S. donation. Source: https://t.co/865xSBV2Ri pic.twitter.com/8BH4RVjUoY— U.S. Embassy in the Philippines (@USEmbassyPH) March 5, 2021In February, the US pledged to donate a total of P194.4 billion ($4 billion) to the COVAX facility to help the world's most vulnerable and at-risk populations in getting COVID-19 vaccines.Team Europe, consisting of the EU and its member states with the European Investment Bank, meanwhile said it has to-date provided P130 billion (€2.2 billion) to COVAX.No one is safe until everyone is safe. His Excellency Luc Véron, Ambassador of the European Union to the Philippines,...Posted by European Union in the Philippines on Thursday, 4 March 2021EU Ambassador Luc Véron highlighted that the Philippines will receive vaccines for 22 million Filipinos under the COVAX facility.""The EU has both a responsibility and interest to make vaccines available to all. The European Union has maintained its goal to work in solidarity for vaccine cooperation and multilateralism — none is safe until everyone is safe,"" Véron said Thursday.According to one of the officials leading the country's pandemic response team, the government may start distributing the AstraZeneca jabs on Friday or Saturday.“Maybe the distribution of AstraZeneca vaccine to different hospitals will begin either later today or tomorrow,” Vince Dizon, deputy chief implementer of the National Task Force Against COVID-19, said in an interview on Teleradyo. — Patricia Lourdes Viray with report from Gaea Katreena Cabico",Philstar
11,https://www.philstar.com/headlines/2021/03/05/2082164/distribution-astrazeneca-covid-19-vaccines-hospitals-may-begin-friday-official,None,2021-03-05,Distribution of AstraZeneca COVID-19 vaccines to hospitals may begin Friday — official,"MANILA, Philippines — The government may start deploying close to 500,000 doses of the COVID-19 vaccine developed by British Swedish firm AstraZeneca and Oxford University to different hospitals nationwide late Friday, an official leading the country’s pandemic response said.“Maybe the distribution of AstraZeneca vaccine to different hospitals will begin either later today or tomorrow,” Vince Dizon, deputy chief implementer of the National Task Force Against COVID-19, said in an interview on Teleradyo.Related StoriesAstraZeneca jabs being eyed for elderly medical personnel, officials sayAfter delays, first AstraZeneca jabs from COVAX arrive in PhilippinesIn a separate interview on CNN Philippines, Dizon said the rollout of AstraZeneca jabs will “start immediately.”After delays, some 487,200 doses of AstraZeneca obtained through the COVAX facility arrived in the Philippines Thursday night. The number of doses was lower than the 526,000 that the government expected to receive last Monday.The Philippines is expected to receive 4.58 million doses of the AstraZeneca vaccine from COVAX facility along with 117,000 doses of the vaccine developed by Pfizer-BioNtech.Dizon, who is also the country’s testing czar, said hospitals that received donated Sinovac jabs will also receive AstraZeneca shots.“They will also receive [AstraZeneca] because both will be rolled out simultaneously based on the order of the president so medical frontliners will have a choice,” he said.Vaccine czar Carlito Galvez Jr. earlier said the government aims to vaccinate between 1.7 million and 2 million health workers by end-March. But it faces challenges not limited to the stock of the coveted jabs but also the reluctance of the public to get inoculated.“So every vaccine that comes in, regardless of brand, would be for them. So hopefully by end of March or April, we could vaccinate all our healthcare workers,” Dizon said. The government is eyeing to administer the AstraZeneca vaccine to elderly medical personnel. Sinovac, the only vaccine currently being rolled out, is only recommended by the National Immunization Technical Advisory Group for people aged between 18 and 59 years.The World Health Organization stands by the use of AstraZeneca vaccine despite a preliminary study suggesting the jab offered less protection against the variant first seen in South Africa, its representative to the Philippines said Thursday. The country has so far detected six cases of B.1.351.To date, the Philippines has recorded over 584,000 COVID-19 cases, including more than 12,000 deaths. — Gaea Katreena Cabico",Philstar
